{
  "candidate_id": "MC-OTP-C-PERMANENT-EXECUTION-CANDIDATE-001",
  "candidate_state": "evidence_prepared",
  "files": [
    {
      "bytes": 562,
      "git_blob_sha1": "88c896b1b95895b65c8ad031963b65bd6391f366",
      "name": "axiom-check.json",
      "sha256": "bc3040f16ad13fc344184fca8310a6a6743a4c127f918d7672f7b85bbe99d8d5"
    },
    {
      "bytes": 311,
      "git_blob_sha1": "56bd3468ed560df54da319aaf4356bed1d57e663",
      "name": "challenge-build.log",
      "sha256": "87757e6bc2f970d49627e894827a4eb72ef044fb0748801aca33aa1b1e6a67d9"
    },
    {
      "bytes": 2202,
      "git_blob_sha1": "f3e4769527ddee261526f7b9e8f5c0c634c00058",
      "name": "comparator.log",
      "sha256": "5e6a5156dba899a27308085070df82cc3f98da4c64963b0df059c4b5100c7bfa"
    },
    {
      "bytes": 1426,
      "git_blob_sha1": "32e2c2a4c8182dfe74debd9794c4d394c1a76f5a",
      "name": "environment.txt",
      "sha256": "6656c65a4a5f7ed092b4dcdb303972dbdcf97d5c5a62042209831ce7cd5e40f5"
    },
    {
      "bytes": 3826,
      "git_blob_sha1": "be7fa0bcb85de92a3c8867e0ad1c2bff1a42f6ac",
      "name": "evidence-summary.json",
      "sha256": "1ba33a998ad3d145bbfa89b7df8e0e303b4ff5c906aa3c0ceff016ebd3bbf694"
    },
    {
      "bytes": 7402,
      "git_blob_sha1": "4e0821e064eca09bf0106ec623a2448e9a1c76a9",
      "name": "execution-candidate.json",
      "sha256": "c5f109008c87710dbf1c7e49800b6be8ca730a684b0d13201f2b0a1dcfe14ee7"
    },
    {
      "bytes": 0,
      "git_blob_sha1": "e69de29bb2d1d6434b8b29ae775ad8c2e48c5391",
      "name": "nonvacuity-replay.log",
      "sha256": "e3b0c44298fc1c149afbf4c8996fb92427ae41e4649b934ca495991b7852b855"
    },
    {
      "bytes": 81,
      "git_blob_sha1": "06234a3bf971eb9b9af9cf99a7bd4a664107fb57",
      "name": "solution-build.log",
      "sha256": "610764aaeb981cb4c7dddb1ecd336c70c416ef8de587e5d065e9bdfb97ffb41d"
    },
    {
      "bytes": 1333,
      "git_blob_sha1": "51b9223a68c7d1b0479338e639f14c918b365e8c",
      "name": "source-identities.txt",
      "sha256": "4fc046daabcb0496cb9c6cb09dc76e3095e14356b13dc683f83c34a98a5dc151"
    },
    {
      "bytes": 286,
      "git_blob_sha1": "b64d1dc32de9621d17425d279b09782ab7b3075d",
      "name": "theorem-axioms.log",
      "sha256": "3efbf04c402d7583bb612e1cf524f4d5ad267c6962bf53b922ea3f021e7f246d"
    },
    {
      "bytes": 170,
      "git_blob_sha1": "1cde426493a9aef07f3cf1477738d7cc0fa18b28",
      "name": "trust-boundary-scan.txt",
      "sha256": "6578688b32859c07f27f1367848d8189a9f9ee83ce50e23837113ee166c998c9"
    }
  ],
  "record_type": "openai_ten_proofs_permanent_execution_candidate_manifest",
  "schema_version": "1.0.0"
}
